{
  "id": "fact-bi-han-noob-original",
  "type": "fact",
  "name": "Bi-Han later becomes Noob Saibot in the original continuity",
  "subjectId": "bi-han",
  "predicate": "uses_identity",
  "value": "Noob Saibot",
  "timelineIds": ["original"],
  "canonStatus": "canon",
  "sourceIds": ["mk30-sub-zero-profile", "mk-deception-noob-smoke-ending"]
}
