{
  "id": "fact-smoke-killed-by-sindel-reboot",
  "type": "fact",
  "name": "Sindel killed Smoke",
  "subjectId": "tomas-vrbada",
  "predicate": "killed_by",
  "objectId": "sindel",
  "timelineIds": ["reboot"],
  "canonStatus": "canon",
  "sourceIds": ["mk9-story"],
  "notes": "Mortal Kombat (2011) story mode directly shows Sindel kill Tomas Vrbada as Smoke during her assault on Earthrealm's defenders."
}
