{
  "id": "fact-dvorah-secretly-served-quan-chi-reboot",
  "type": "fact",
  "name": "D'Vorah secretly served Quan Chi",
  "subjectId": "dvorah",
  "predicate": "secretly_served",
  "objectId": "quan-chi",
  "timelineIds": ["reboot"],
  "canonStatus": "canon",
  "sourceIds": ["mkx-story"],
  "notes": "Mortal Kombat X Story Mode reveals through D'Vorah's private contact with Quan Chi that her apparent service in Kotal Kahn's court concealed a secret allegiance to Quan Chi. This changing allegiance is represented as a scoped Fact rather than timeless Character metadata."
}
